{
  "schema_version": "1.0",
  "document_id": "INF01045",
  "institution": "Universidade Federal do Rio Grande do Sul (UFRGS)",
  "academic_period": "2026/2",
  "course": {
    "code": "INF01045",
    "name": "CIBERSEGURANÇA",
    "credits": 4,
    "workload": {
      "unit": "hours",
      "theoretical": 50,
      "practical": 10,
      "total": 60,
      "collective": 50,
      "autonomous": 10,
      "individual": 0,
      "extension": 0
    }
  },
  "curricula": [
    {
      "program": "BACHARELADO EM CIÊNCIA DA COMPUTAÇÃO",
      "recommended_stage": 7,
      "recommended_stage_status": "explicit",
      "nature": "Obrigatória"
    },
    {
      "program": "ENGENHARIA DE COMPUTAÇÃO",
      "recommended_stage": 9,
      "recommended_stage_status": "explicit",
      "nature": "Eletiva"
    }
  ],
  "prerequisites": null,
  "syllabus": "Conceitos, propriedades e princípios em cibersegurança. Questões legais, éticas e humanas. Criptografia e esteganografia.\nAutenticação e autorização, controle de acesso. Governança de cibersegurança.",
  "objectives": "Estudar segurança em três aspectos distintos da computação: segurança de dados, segurança em redes e segurança de\ncomputadores pessoais. Apresentar os principais tipos de ataques e as principais ferramentas utilizadas para sua prevenção.\nPermitir que o aluno compreenda e saiba analisar as características de um sistema de computação quanto a sua segurança.",
  "content_program": "Semana: 1 a 3\nTítulo: Introdução\nConteúdo: Apresentação da disciplina (plano de ensino, Moodle, sistema de avaliação). Conceitos e propriedades em segurança. Risco,\nvulnerabilidades, ameaças e vetores de ataque. Princípios de segurança. Princípios de privacidade. Segurança de ponta a ponta.\nDefesa em profundidade . Segurança por design. Tensões entre segurança e outros objetivos de design. Ataques à privacidade e ao\nanonimato.\nSemana: 4\nTítulo: Questões legais, éticas e humanas\nConteúdo: Questões legais e ética. Objetivos, capacidades e motivações do invasor. Engenharia social\nSemana: 5 a 9\nTítulo: Criptografia e esteganografia\nConteúdo: Tipos de cifras juntamente com métodos de ataque típicos. Cifras de bloco e de fluxo. Criptografia de chave simétrica.\nCriptografia de chave pública. Criptografia quântica e resistente à computação quântica. Canais secretos e esteganografia.\nSemana: 10 a 11\nTítulo: Protocolos criptográficos e aplicações de criptografia\nConteúdo: Protocolos criptográficos. Infraestrutura de chave pública (PKI) e certificados. Assinaturas digitais. Códigos de autenticação de\nmensagem. Integridade da mensagem. Suporte de infraestrutura de chave pública para assinatura digital e criptografia e seus\n\ndesafios. Criptografia para segurança de dados e rede.\nSemana: 12 a 13\nTítulo: Autenticação e autorização, controle de acesso\nConteúdo: Modelos de autenticação e autorização, controle de acesso. Mecanismos de autenticação e autorização, controle de acesso.\nSemana: 14\nTítulo: Blockchain\nConteúdo: Consenso seguro. Árvores de Merkel. Livro razão.\nSemana: 15\nTítulo: Governança de Cibersegurança\nConteúdo: Gestão da Segurança da Informação. Gestão de Continuidade de Negócio",
  "teaching_methods": "A disciplina utilizará o sistema Moodle/UFRGS para distribuição de material, entrega de trabalhos, organização de grupos de\ndiscussão e acompanhamento geral da disciplina. A disciplina é apresentada em aulas teórico-práticas, em que se combina aulas\nexpositivas para apresentação dos conceitos e técnicas com o desenvolvimento de eventuais exercícios e discussões. Algumas das\naulas serão realizadas em laboratórios, para a implementação/visualização dos conceitos vistos em aula (por exemplo, criptografia\nde dados e exemplos de ataques e contramedidas de rede).\nAs 60 horas previstas para atividades teóricas e práticas indicadas neste Plano de Ensino incluem 30 encontros de 100 minutos de\nduração (2 períodos de 50 minutos por encontro, 2 encontros por semana, durante 15 semanas), num total de 3.000 minutos, e mais\n10 horas (600 minutos) de atividades autônomas, realizadas sem contato direto com o professor, correspondentes a exercícios e\ntrabalhos extraclasse a serem avaliados.\nO professor poderá se valer de aulas presenciais e de atividades a distância (desde que nos limites previstos pela UFRGS para\ndisciplinas presenciais e empregando ferramentas para atividades remotas), assim como do apoio de Professores Assistentes\n(Alunos de Pós-Graduação) em Atividades Didáticas.",
  "learning_experiences": "Os estudantes participarão de aulas expositivas dialogadas para compreender os principais conceitos relacionados com\nCibersegurança; realizarão aulas em laboratório voltadas aos aspectos discutidos nas aulas teóricas; apresentarão artigos sobre\ntópicos emergentes na área; poderão realizar leituras de materiais técnicos disponibilizados ao longo da disciplina e assistir a vídeos\ne vídeo-aulas que complementam os temas discutidos. Além disso, poderão responder a questionários que auxiliarão na\nconsolidação do aprendizado e na verificação da compreensão dos tópicos abordados.",
  "assessment": "A avaliação será realizada por meio de duas atividades de avaliação de aprendizagem (P1 e P2), que poderão conter questões\ndiscursivas, analíticas ou objetivas de múltipla escolha sobre o conteúdo apresentado, incluindo os tópicos abordados nos exercícios\ne trabalhos extraclasse.\nAlém dessas atividades, serão propostas Atividades Autônomas (AA) ao longo do semestre (por exemplo, a entrega e apresentação\nde um resumo sobre um tópico emergente em segurança de redes, escolhido pelo próprio aluno), cuja média integrará a média final\ncom peso de 20%.\nSerá considerado aprovado o discente que obtiver Média Final (MF) mínima de SEIS (6,0), calculada da seguinte forma:\nMF = 0,4 * P1 + 0,4 * P2 + 0,20 * AA\n\nonde P1 e P2 são, respectivamente, as notas da primeira e segunda atividades de avaliação de aprendizagem, e AA a média das\nAtividades Autônomas. O conceito final do discente será atribuído com base na nota final (MF), conforme a seguinte tabela:\n\n- Conceito A, para MF>=9,0;\n- Conceito B, para MF>=7,5 e MF<9,0;\n- Conceito C, para MF>=6,0 e MF<7,5;\n\n- Conceito D, para MF<6,0.\n\nConforme regulamento da Universidade, é obrigatório uma frequência mínima de 75% de presença nas aulas. A não observância a\nesse requisito implicará conceito FF."
}
