{
  "schema_version": "1.0",
  "document_id": "INF01046",
  "institution": "Universidade Federal do Rio Grande do Sul (UFRGS)",
  "academic_period": "2026/2",
  "course": {
    "code": "INF01046",
    "name": "PROCESSAMENTO DE IMAGENS E VISÃO COMPUTACIONAL I",
    "credits": 4,
    "workload": {
      "unit": "hours",
      "theoretical": 50,
      "practical": 10,
      "total": 60,
      "collective": 50,
      "autonomous": 10,
      "individual": 0,
      "extension": 0
    }
  },
  "curricula": [
    {
      "program": "BACHARELADO EM CIÊNCIA DA COMPUTAÇÃO",
      "recommended_stage": 6,
      "recommended_stage_status": "explicit",
      "nature": "Obrigatória"
    },
    {
      "program": "BACHARELADO EM FÍSICA",
      "recommended_stage": 4,
      "recommended_stage_status": "explicit",
      "nature": "Eletiva"
    },
    {
      "program": "BACHARELADO EM FÍSICA: ASTROFÍSICA",
      "recommended_stage": 6,
      "recommended_stage_status": "explicit",
      "nature": "Eletiva"
    },
    {
      "program": "BACHARELADO EM FÍSICA: FÍSICA COMPUTACIONAL",
      "recommended_stage": null,
      "recommended_stage_status": "blank_in_source",
      "nature": "Eletiva"
    },
    {
      "program": "ENGENHARIA DE COMPUTAÇÃO",
      "recommended_stage": 8,
      "recommended_stage_status": "explicit",
      "nature": "Eletiva"
    },
    {
      "program": "ENGENHARIA FÍSICA",
      "recommended_stage": 5,
      "recommended_stage_status": "explicit",
      "nature": "Eletiva"
    }
  ],
  "prerequisites": null,
  "syllabus": "Percepção visual e modalidade de imagens. Transformações de imagens: Equalização de Histograma e outras transformações não\nlineares, Transformada de Fourier. Filtragem de imagens: domínios espacial e frequência. Teorema da Amostragem e Teorema da\nConvolução. Restauração de imagens. Segmentação de imagens. Compressão de imagens e vídeos. Modelos de câmeras.\nCalibração. Estereoscopia e multi-view estéreo, Classificação de imagens. Detecção de objetos. Introdução a aprendizado profundo\npara Computação Visual. Questões éticas e sociais envolvendo imagens.",
  "objectives": "A disciplina visa desenvolver as seguinte habilidades específicas:\n●Capacitar os alunos a desenvolver, implementar e avaliar aplicações que manipulam a representação digital de dados\nvisuais, como imagens e vídeos, utilizando com plena capacidade os princípios matemáticos associados.\n●Compreender a relação entre representações digitais e os fenômenos visuais que ali estão codificados.\n●Capacitar os alunos a desenvolver, implementar e avaliar soluções capazes de extrair informações relevantes a partir de\ndados visuais.",
  "content_program": "Semana: 1 a 2\nTítulo: Introdução a processamento de imagens e visão computacional, e operações pontuais sobre imagens\nConteúdo: Introdução a processamento de imagens e visão computacional, e operações pontuais sobre imagens\nSemana: 3 a 4\nTítulo: Operações com conjuntos de pixels\nConteúdo: Operações com conjuntos de pixels e filtragem espacial\nSemana: 6 a 7\nTítulo: Transformada de Fourier, domínio frequência, compressão\nConteúdo: Transformada de Fourier, operações no domínio frequência, compressão\nSemana: 8 a 9\nTítulo: Côres, segmentação, 1a. avaliação\nConteúdo: Côres, segmentação de imagens, 1a. avaliação\nSemana: 10 a 11\n\nTítulo: Visão 3D\nConteúdo: Visão computacional 3D\nSemana: 12 a 14\nTítulo: Rastreamento, Classificação, Detecção de Objetos, Avaliação Final\nConteúdo: Rastreamento, classificação e detecção de objetos em imagens e avaliação final\nSemana: 15\nTítulo: Apresentações dos Projetos Finais\nConteúdo: Apresentações dos Projetos Finais",
  "teaching_methods": "A disciplina utilizará o sistema Moodle/UFRGS para distribuição de material, entrega de trabalhos, organização de grupos de\ndiscussão e acompanhamento geral da disciplina.\n\nAs 60 horas previstas para atividades teóricas e práticas indicadas neste Plano de Ensino incluem 30 encontros de 100 minutos de\nduração (2 períodos de 50 minutos por encontro, 2 encontros por semana, durante 15 semanas), num total de 3.000 minutos, e mais\n10 horas (600 minutos) de atividades autônomas, realizadas sem contato direto com o professor, correspondentes a exercícios e\ntrabalhos extraclasse, conforme Resolução 11/2013 do CEPE/UFRGS, Artigos 36 a 38. O conteúdo da disciplina é abordado tanto\nem aulas expositivas como em trabalhos práticos. Os assuntos são complementados e reforçados através da realização de\nexercícios em aula ou extra-classe e do desenvolvimento de programas.",
  "learning_experiences": "Ao longo do semestre, serão realizados:\n\n1) Trabalhos Práticos (TPs) realizados ao longo do semestre. Nestes trabalhos, os estudantes serão solicitados a executar,\nmodificar, complementar, estender e desenvolver códigos visando a fixação dos conhecimentos estudados;\n\n2) Um Projeto Final (PF) realizado ao final da disciplina. O projeto prevê uma implementação, escrita de relatório e apresentação dos\nresultados para a turma;\n\n3) Duas provas, P1, na metade do semestre, e P2, prova final.",
  "assessment": "Os alunos serão avaliados com base no desempenho nas provas, trabalhos práticos e no projeto final, bem como por sua\nparticipação em aula. As provas, trabalhos e projeto final serão avaliados com nota entre 0.0 e 10.0. Conforme regulamento da\nUniversidade, a frequência às aulas é obrigatória. Ao longo do semestre, serão realizados:\n\ni. Duas provas, P1 e P2, e cada prova corresponderá a 20% da nota final;\n\nii. Trabalhos Práticos (TP1 e TP2) correspondendo a 35% da nota final dos trabalhos práticos TP = (TP1 + TP2)/2;\n\niii. Um projeto final (PF) da disciplina, representando 20% da nota final.\n\nAlém disso, será atribuída nota pela participação (NP) nas aulas, o que representará 5% da nota final. A realização dos trabalhos é\nobrigatória, mesmo que o aluno obtenha bons resultados nas provas.\n\nA média geral (MG) será obtida por meio da seguinte fórmula:\n\nMG = 0,20*P1+ 0.20*P2 + 0.35*TP + 0.20*PF + 0.05*NP\n\nA conversão da MG para conceitos é feita por meio da seguinte tabela:\n\n9,0 <= MG <= 10,0: conceito A (aprovado).\n7,5 <= MG < 9,0: conceito B (aprovado).\n6,0 <= MG < 7,5: conceito C (aprovado).\n0,0 < MG < 6,0: conceito D (ou conceito obtido na recuperação)."
}
